id|question|opt1|opt2|opt3|opt4|answer|tags|time_limit_seconds
39|परियोजना रिपोर्ट में 'शुरुआती दस्तावेज़ीकरण' (Initial Documentation) क्यों आवश्यक है?|यह केवल कागजात जमा करना है|परियोजना के लक्ष्य, आवश्यकताएँ और प्रारंभिक योजना स्थापित करने के लिए|यह अनावश्यक है|केवल अंतिम रिपोर्ट को छुपाने के लिए|परियोजना के लक्ष्य, आवश्यकताएँ और प्रारंभिक योजना स्थापित करने के लिए|SEC-3_U4_T4.5.2|30
40|एक अच्छी रिपोर्ट में 'प्रूफरीडिंग' (Proofreading) क्यों आवश्यक है?|यह केवल समय बर्बाद करता है|व्याकरण, वर्तनी और तथ्यात्मक त्रुटियों को खत्म करने के लिए|यह रिपोर्ट को जटिल बनाता है|यह केवल एक नियम है|व्याकरण, वर्तनी और तथ्यात्मक त्रुटियों को खत्म करने के लिए|SEC-3_U4_T4.5|30
41|विश्लेषणात्मक रिपोर्ट का कौन सा खंड 'समस्या' (Problem) को पहचानता है?|सिफारिशें|परिचय|परिशिष्ट|संदर्भ सूची|परिचय|SEC-3_U4_T4.5.1|30
42|परियोजना रिपोर्ट में 'परियोजना शीर्षक' (Project Title) कैसा होना चाहिए?|अस्पष्ट और जटिल|परियोजना के दायरे और फोकस को स्पष्ट रूप से दर्शाने वाला|बहुत लंबा और दोहराव वाला|केवल एक शब्द का|परियोजना के दायरे और फोकस को स्पष्ट रूप से दर्शाने वाला|SEC-3_U4_T4.5.2|30
43|रिपोर्ट लेखन में 'सरल और प्रत्यक्ष भाषा' का उपयोग क्यों करना चाहिए?|यह रिपोर्ट को जटिल बनाता है|संदेश को प्रभावी ढंग से और स्पष्ट रूप से संप्रेषित करने के लिए|यह केवल एक नियम है|यह पेशेवर नहीं लगता|संदेश को प्रभावी ढंग से और स्पष्ट रूप से संप्रेषित करने के लिए|SEC-3_U4_T4.5|30
44|विश्लेषणात्मक रिपोर्ट में 'वैकल्पिक समाधानों' (Alternative Solutions) का मूल्यांकन क्यों किया जाता है?|केवल समय बर्बाद करने के लिए|सबसे प्रभावी सिफारिश तक पहुँचने के लिए|यह केवल एक औपचारिकता है|यह रिपोर्ट को गोपनीय रखता है|सबसे प्रभावी सिफारिश तक पहुँचने के लिए|SEC-3_U4_T4.5.1|30
45|परियोजना रिपोर्ट में 'उपयोग किए गए संसाधन' (Resources Utilized) का उल्लेख क्यों किया जाता है?|यह अनावश्यक है|परियोजना के लिए आवश्यक सामग्री, उपकरण और मानव श्रम को दर्शाने के लिए|यह केवल सजावट है|केवल व्यक्तिगत राय देने के लिए|परियोजना के लिए आवश्यक सामग्री, उपकरण और मानव श्रम को दर्शाने के लिए|SEC-3_U4_T4.5.2|30
46|रिपोर्ट का 'पूरक' (Transmittal) पत्र क्या है?|यह केवल रिपोर्ट को लंबा बनाता है|रिपोर्ट भेजने वाले और प्राप्त करने वाले को सूचित करने वाला एक संक्षिप्त पत्र|निष्कर्ष|सिफारिशें|रिपोर्ट भेजने वाले और प्राप्त करने वाले को सूचित करने वाला एक संक्षिप्त पत्र|SEC-3_U4_T4.5|30
47|विश्लेषणात्मक रिपोर्ट में 'पक्षपात' (Bias) क्यों नहीं होना चाहिए?|यह रिपोर्ट को रोचक बनाता है|निष्पक्षता, विश्वसनीयता और तार्किक निष्कर्ष सुनिश्चित करने के लिए|यह केवल एक नियम है|यह रिपोर्ट को गोपनीय रखता है|निष्पक्षता, विश्वसनीयता और तार्किक निष्कर्ष सुनिश्चित करने के लिए|SEC-3_U4_T4.5.1|30
48|परियोजना रिपोर्ट में 'निष्कर्ष' में क्या होना चाहिए?|केवल नई जानकारी|परियोजना के लक्ष्यों की प्राप्ति का अंतिम बयान|सिफारिशें|केवल व्यक्तिगत राय|परियोजना के लक्ष्यों की प्राप्ति का अंतिम बयान|SEC-3_U4_T4.5.2|30
49|रिपोर्ट लेखन में 'लक्षित दर्शकों' (Target Audience) को ध्यान में रखना क्यों महत्वपूर्ण है?|यह अनावश्यक है|भाषा, विस्तार का स्तर और प्रारूप को अनुकूलित करने के लिए|यह केवल एक औपचारिकता है|यह रिपोर्ट को गोपनीय रखता है|भाषा, विस्तार का स्तर और प्रारूप को अनुकूलित करने के लिए|SEC-3_U4_T4.5|30
50|विश्लेषणात्मक रिपोर्ट के 'निष्कर्ष' में 'नया डेटा' क्यों नहीं पेश किया जाना चाहिए?|यह केवल रिपोर्ट को लंबा बनाता है|निष्कर्ष केवल मुख्य भाग में प्रस्तुत किए गए डेटा का सारांश और व्याख्या करता है|यह केवल एक नियम है|यह अप्रासंगिक है|निष्कर्ष केवल मुख्य भाग में प्रस्तुत किए गए डेटा का सारांश और व्याख्या करता है|SEC-3_U4_T4.5.1|30